body,subreddit
"When using <a href> once the client hovers over the <a> element, at the left bottom corner he'll see what link your directing them. Many clients, so am I, like to see what link you're directing them into.",Javascript
"Both of the ugly here are for web deployed apps.  
For electron apps I'm going to keep using css in js. It's a lot cleaner and nicer to use than webpack integrated less/css module styles and other alternatives I've used.",Javascript
"This is great! Thank you!

There’s one thing missing from number format though I believe, the locale provider. 

The output should render differently if I choose USD with a locale of en-ca for example.",Javascript
I built my own music player to listen during coding sessions at work to improve my productivity. Built it in React framework and just used Javascript's inbuilt Audio API to implement the player functionality. The app is running at [https://unmusic.github.io](https://unmusic.github.io) and source code is available in [Github](https://github.com/unmusic/unmusic.github.io). Please check it out and give feedback.,Javascript
"Hi everyone!

I’m a high school senior in NYC who’s been building [Alu Learn](https://alulearn.com/l/signup): a website that uses spaced repetition flashcards to optimize memory retention and help students learn more effectively.  I’ve focused on creating flashcards for different AP Exams, exams that many high schoolers take to get college credit.

You can check it out at [alulearn.com](https://alulearn.com/l/signup)",Javascript
"Hey everyone!

I've been creating several in-depth Javascript tutorials and exercises which I've been posting on Youtube daily. I would love any feedback or criticism: [https://www.youtube.com/channel/UCw3LzfWsv-xXTFI6Q4Y4SwQ/](https://www.youtube.com/channel/UCw3LzfWsv-xXTFI6Q4Y4SwQ/)

I've been teaching programming for several years and was both humbled and saddened by the struggles so many students had when learning. Going through the ""traditional"" path myself, I wanted to share as much as I can that I've learned from both industry and teaching.

Being a super nerd at heart and overly fond of programming, I want to do whatever possible to share that love and help others break in to the field and see if it's right for them :)",Javascript
"I use Nunjucks for a templating engine with my nodejs website at my job. This is a website that serves a few thousand employees. But I'm a bacnkend programmer who created this website out of neccesity so to answer your question, I dont know.",Javascript
"In my experience, many legacy enterprise applications are using some sort of templating language. If you are working in a large enterprise be prepared to fix issues in these applications as they stick around forever.",Javascript
"Template Engines are still very much a thing. JAMStack static site builders like 11ty, Jekyll still leverage template languages. In terms of Enterprise,  Shopify theme development relies on the Liquid template Engine for its webshops.   


Aside from Shopify and JAMStack, frameworks also employ them. You have Blade (Laravel), EEX (Embedded Elixir) and many more. Use cases vary for the applied usage but very prevalent in SaaS platforms which need a safe consumer facing language.",Javascript
Yes.  I'm not sure how others use template engines but the way we use a template engine is to generate documents that eventually gets served to customers related to their billing information or account information.  These documents are either viewed as PDF(s) for the customer or get mailed out to the customer (if they selected to receive mailing for any billing/charges).,Javascript
"1. This is incorrect. Shadowmaps are associated with lights. Lights can be enabled for different objects via .layers.  
2. In threejs you can render on demand at any time. You call renderer.render().  
3. Threejs IS ""just"" a renderer, but there are Game Engines built on top of it.. and there are samples that encapsulate many game behaviors like integration with physics libraries (ammo.js/cannon.js), AR/VR, and a pointerlock samples..  (as do PlayCanvas and AFrame and other engines).  But generally threejs seems to focus on rendering instead of being a monolothic engine. If a full game engine is your style, there are a number of them available, including ones with ts bindings/written in ts. There are also facilities for running on web via Unity or Unreal.  
4. WebGPU hasn't landed in browsers so how this will work in threejs is still up in the air a bit, but there is a wip WebGPU renderer.  
5. You can already do something similar to the described ""snapshot rendering"" in threejs in all browsers today, by disabling matrixAutoUpdate on the scene, and calling the renderer.render in threejs. I think you can also create a shallow clone of scene hierarchies that may fill the same purpose. This will skip doing the transformation hierarchy update and just render the buffers as they are encountered, though the use case for this still seems dubious to me, since modelviewmatrices need to be recomputed when viewpoints change.. and material changes may require different/additional matrix inputs depending on what they have enabled, hence requiring a matrix update traversal anyway.  
6. Tooling:THREEJS has the threejs editor.. (here: https://threejs.org/editor/ ) which allows inspection/editing/scripting of scene components/properties. It's also just another component in the library and can be modified to suit the needs of game engines built on top of threejs.  PlayCanvas and I believe AFrame both offer similar functionality.  
7. threejs used to have a blender exporter, but this was deprecated in favor of deeply supporting the GLTF format. You can add custom properties to objects in blender and these will be exported via the GLTF exporter.Additionally.. the gltf-pack tool can modify, transform, and compress gltf files by orders of magnitude over what is offered by other formats. We deal with models at my current job that start out at 100-200 megabytes and can compress down to <\~10 megabytes via gltfpack. Not only do you gain on disk/wire compression, the models and textures can stay ""compressed"" in memory, and thus have a smaller GPU footprint and reduce vertex/texture bandwidth in the renderer. it's pretty amazing. (Ibelieve this is interoperable with babylon as well, and i highly recommend checking it out!)  
8. Community and support. The threejs community is vast, and there are lots of people working on the engine. I haven't encountered engine bugs in a long time as it is relatively stable especially if you are pinned to a known version of threejs. There ma",Javascript
"So we've set up a pipeline that does latest dependency updates for us daily (using npm-check-updates). Our package.json pins version on patch but the pipeline itself always updates to the latest version regardless of pinning then creates a PR to test.

If it breaks we don't merge it, but now we know we have to plan in work to update to the latest version. 

If you're updating dependencies on the major without testing, IMHO if your app breaks own it.",Javascript
"Our team used Linaria extensively and found it to work to pretty. Slightly more convenient than `styled-components` even. Yes, it uses inline styles to handle dynamic props, but other than that it solved all the downsides mentioned in this post, at least. It cleanly generates a separate CSS that is loaded the way hand-written CSS would be.

Ultimately we did move away from it, but that was because it’s exclusive to Babel, and we really wanted to move to SWC, because of the performance benefits.",Javascript
I feel like the actual takeaway here is to have functional tests. If all your tests mock axios (probably not an unreasonable assumptions for unit testing to not make actual network calls) then you wouldn't have noticed the issue anyway - even if you did have a lockfile.,Javascript
"These people have a problem with their production setup. If your production can break out of the blue because of a third party updating their library, you’re doing it wrong, very wrong:

1.	Referencing dependencies directly via a cdn (without a specific version).
2.	Not installing the dependency via a package manager.
3.	Not having any tests in place before you deploy to production.

We should call them out on it before they complain to an open source maintainer…",Javascript
"Ok, there’s apparently a whole parallel universe that’s like the Wild West where devops best practices don’t exist … and they seem to think it’s how it’s *supposed to be done*.  

Not quite as crazy, the folks in this thread seem to be surprised that the others exist. Sorry to shock you but, anybody can bang on the keyboard, deploy, and then call themselves a “software engineer.”

“When you have a computer they let you do it. You can do anything. Grab 'em by versionless URL. You can do anything.”",Javascript
"As always, people blame the users, and not the infrastructure. Maybe the JS community can benefit from a package manager that doesn't enable so much foot shooting. At the very least, npm/yarn should not use wildcard versions by default, and considering how maddeningly chaotic dependency trees can get, maybe getting rid of wildcards altogether would be beneficial.",Javascript
"Page straight up crashed chrome on my phone lol. And it keeps crashing, freezing, and eventually killing the page or the OS.

GitHub also needs to get their crap together and handle rendering less elements to the DOM per comment I guess haha",Javascript
Just a friendly reminder that the polyfill used here is enormous because it was written more as a means of experimentation with the proposal than as a polyfill that is ready for production. You're probably better off sticking with a smaller date library for the time being and switching to Temporal once it reaches stage 4 and has a suitable polyfill in place.,Javascript
"It depends. I'm a senior frontend engineer, and while the obvious answer to the question asked by the audience is ""yes"", I couldn't tell you the ""how"" any more than he can. To me, there is no concept of ""senior react engineer"" or ""senior angular engineer"" because those are just frameworks/libraries, and you can get good at them to a degree while having never learned the underlying language, but unless you learn the underlying language, you'll never really be truly good at the framework. A century or so ago, we had this same debate about whether Ruby on Rails engineers were really ruby engineers. What makes someone a senior frontend engineer to me is their language skills - html, css, js (and build tools, etc - the ecosystem that modern js uses). A senior engineer can relatively easily pick up whatever framework is needed for the job because at the end of the day, it's all just javascript.

What makes a senior engineer is very subjective, so to the speaker, he is whatever he says he is (assuming he truly does have experience and skill in his craft). To you, he might not qualify to be a senior engineer because he's not familiar enough with all the modern frameworks, and that's perfectly acceptable.

So I guess the answer is (as with everything else lol) ""it depends"".

Edit: added minor clarification",Javascript
"He is a senior who specializes in React.

Just like there are many doctors, you ask an eye doctor about your heart, the doctor will refer you to a heart doctor.

Eye doctor might have a slight idea, but will still refer you to heart doctor.",Javascript
"The ""senior"" designation has no correlation to number of frameworks under your belt, it's meant to correlate to a baseline of architectural and/or team leading skills.

More likely than not, they are just using their official title from work and you're reading too much into it.",Javascript
"I have built major projects on 6 different frameworks and am very much a senior, but I am only senior level on 2 of the frameworks i have used.  


To me a senior is someone with the capability to solve most problems on their own, they understand the process of creation from discovery to deployment, and stand ready to tackle projects outside their expertise as a 'challenge'

If you are looking for someone who knows every framework and every language out there at a senior level...they do not exist....and if they claim they do, they are full of it.",Javascript
"Has anyone tried compiled? [https://compiledcssinjs.com/](https://compiledcssinjs.com/)

From my understanding, it gives you all the css-in-js api but it compiles it into css during build time so you have less runtime overhead.",Javascript
"You're right, in that those techniques are independent of any client-side framework.  You can build libraries to sort of pre-package them into a specific framework, with reusable componentry.  But it's not necessary, they're not connected.  

When people say ""I made an XYZ in React!"" that is a clickbaity way of getting attention.  Really, you can do any client-side technique in any client-side framework, because under the hood, it's all just JavaScript and browsers.  

If people really wanted to be educational, they would divorce the technique from the framework.  But then nobody would go to their talk.  So, this person is just a huckster, who is targeting React people, and doesn't care to delve into anything else, because it's not useful to them.

Ultimately, the blame is on the webdev community, for letting itself become so framework hypnotized.  He is just working an audience.",Javascript
"Experimented with an erasable canvas in a halloween theme, for the CodePen Pumpkin Challenge. Switching from the light to dark was an interesting learning experience as well.   


Next time I'd implement some sort of flood fill algorithm so that isolated chunks would fall out on their own.",Javascript
"```js
    sql`SELECT * FROM comments WHERE body = ${id}`;
```
is still an SQL injection waiting to happen.

This should have an additional primitive that either makes it explicit for stuff to be injected in the query text like
```js
    sql`SELECT * FROM comments WHERE ${identifier(colName)} = 5;
```
or be marked as query parameter
```js
    sql`SELECT * FROM comments WHERE body = ${parameter(id)}`;
```

I really love the way [pg-sql2](https://github.com/graphile/graphile-engine/tree/master/packages/pg-sql2) is going about that.",Javascript
"Thanks, this is really neat.

Unfortunately the first Live Demo I found is a bit broken on iOS within in-app-browser:

[https://surveyjs.io/form-library/examples/nps-question/reactjs](https://surveyjs.io/form-library/examples/nps-question/reactjs)

The 'On a scale' question presents as a text box, which when tapped opens up a drop-down and the on-screen keyboard. This means the keyboard hides the drop-down. Also, if you type the number you want, the correct drop-down item is selected, then when you click 'Done' the text box is cleared.

There's also visual bugs with the text-box value and cursor appearing above the drop-down menu, and it is very difficult to select the value you want as the drop-down closes when you attempt to scroll to select an off-screen value.",Javascript
"Cool idea. I really am happy to see that OSS is becoming something that folks can sustain themselves. Great idea with indirect dependencies – given the fact that JS/Node community is built on smaller packages, this might really prove significant.

I would suggest offer one-time payment. Maybe that's just me, but seeing subscription model everywhere is really off-putting. And maybe, but this is probably for the long future, ability to manually adjust the amounts (for example, I want to pay more to an unknown package that I use).",Javascript
"Having had a look at the website, it appears that even projects from Meta and Microsoft get money.

Where does that money end up? As these multi billion companies definitely don't need any more from us..

Excluding companies from donations obviously is a territory you wouldn't really want to tread, but this looks really weird.",Javascript
"Something like this could easily be a scam so how are you keeping things transparent and not just collecting money in your own pockets?

Not that you didn't deserve a cut if you do this legit. Definately interested.",Javascript
"Hey JS Community, I'm a long time JS developer that has no doubt benefited from the great work many of you here have contributed over the years. To pay back our thanks and to hopefully make open source development a viable source of income for many more developers, we built StackAid, a service that automatically discovers and funds your direct and indirect (second order) open source dependencies with a monthly subscription. We're obviously excited to get feedback from the community and hear your thoughts. Cheers.",Javascript
"Please excuse any gramatical errors i’m on my phone and english is not my first language.

These are my thoughts, I haven’t read anything but your homepage so maybe you are doing some of this already.

Try to figure out a way to make it tax deductible for at least the countries that make it easy, you will see wider adoption. Not a lawyer but seems plausible.
I know I wouldn’t bat and eyelash as i would think of it as essentially free.

Add some sort of badge that mantainers can use on their readme’s, it doubles as publicity and for mantainers to implicitly confirm that they are receiving the funds.

Make disbursement information publicity available to build trust and independent persons can verify that the money is being allocated fairly.  

Instead of me having to disable each organization that I dont want have presets like “no public companies” so I don’t need to be on top of it.

Add a non subscription option. I want to do it once a year for tax purposes (if you manage to do it) it might not seem fair because it would be a snapshot but you can use the git history to add weights based on the time the dependency was in use.

Great Idea overall, best of luck.",Javascript
"Cool idea but despite the stereotype that programmers all make 150k-500k/year, lots of hungry developers are poor.

People have a problem paying $10-15/month for streaming services that they use for 6+ hours every single day.

I can buy actual useful software development tools for cheaper than $15/month.  That is waaaaaaay too expensive.  You would get much more adoption for something way cheaper.  

$15/mo sounds like a plan for companies and teams that are feeling charitable.  For the average dev $20/year would be way more appealing.",Javascript
"One thing I like about css in JS is our ability to define theme properties like colors in global provider fed populated from an api request and then utilizing those theme variables inside the style objects. 

What’s the ideal way to provide this capability in css modules?",Javascript
"I love this model. I've been subscribed to Coil for a long time, I wish more sites would use it. I was a fan of Google's paid subscription to remove ads across the web. It disappeared because they couldn't figure out a pricing model that worked at that scale.

I hate it when people glorify ad blockers and expect the universe for free. Bringing that model to NPM just makes sense.

Are you manually adding Stripe accounts for these projects? Or is there an expectation that package maintainers have to sign up? Seems like that would slow things down as opposed to an integration with something like OpenCollective.

I think this would require manual adjustment too. Projects with more packages may get an unfair split simply due to their organizational model.",Javascript
"Was impressed when you [posted your library previously](https://www.reddit.com/r/javascript/comments/xob7n9/subsecond_jquery_is_the_best_way_to_transform_a/), and this playground looks terrific.

Been looking at codemods a lot myself recently and taking the jQuery-route to reduce the boilerplate seems inspired. Really great work.",Javascript
"So basically the idea is that you, knowing your specific use case, could write a better ""framework"" for your specific use case?

I mean, yeah, obviously. The point is that most people will consider the time tradeoff, and in most cases, it's better to save the tremendous amount of time than it is to write your own slightly better version of something.

The kicker is that it's not really a ""better"" version because it's not been tested to the same standards and it's not been around long enough to find all the gotchas that will eventually pop up. Performance is not always the most important thing.",Javascript
"This [project](https://leftonread.me/) is a ton of fun, so wanted to share! Using Electron, React, Typescript, and sqlite, I built an open-source Desktop app that analyzes iMessages and curates a Spotify wrapped-like experience. You can download it [here](https://leftonread.me/) or check us out on [github](https://github.com/Left-on-Read/leftonread). Let me know if any qs. It’s entirely open-source and we do not store your data. The beauty of a Desktop app: the data never leaves your computer!",Javascript
Yo. I love this so much. Gonna share this with all of my friends. Could you give some more details on the technical implementation of this? Would love to learn more about your stack. I've always wanted to build something similar to this.,Javascript
Greetings JS experts out there.  I have a weather application that I'm trying to develop in JavaScript.html.css. I'm new on js been doing Java now I'm moving to Angular since I'm now on spring Boot. All I do self taught. Can anyone contribute to the project? I would appreciate so much. As well as for me to keep learning. I can share the source code,Javascript
"> I love legacy codebases.

> A legacy codebase means that the product is performing well. It means that I can often make immediate and impactful improvements.

I gotta give the writer props for saying this and really looking at the glass half full approach. 

I constantly complain about our legacy code. I'm a bitter old man But they're right. I think about all the code I threw away. Dead. Gone. New code replaced it. 

The ones I haven't thrown away because they're still mission critical? They're doing their job. They're holding together. They may be annoying AF to work in... But I and a lot of people's job exist because of this code. And it's too complex to touch without a major intervention. 

I dunno if that's their intention. But I definitely realize I should stop whining about legacy code (at least for a little bit)",Javascript
"If you need to build a form management system that is flexible and self-hosted, and allows non-technical users like content manager to create multiple forms themselves to lift this burden up your shoulders, you might find adding SurveyJS component to your React app a smart decision on dealing with the challenge.
  

  
The getting started tutorial is here: [https://surveyjs.io/survey-creator/documentation/get-started-react](https://surveyjs.io/survey-creator/documentation/get-started-react) 
  

  
You can find the full code for the getting started in the following GitHub repository: [https://github.com/surveyjs/code-examples/tree/main/get-started-creator/react](https://github.com/surveyjs/code-examples/tree/main/get-started-creator/react).",Javascript
"You are getting bugs because you do not have abstraction layer on top of it.

Create methods for saving, deleting, updating items, have try catch for errors and so on. Never access local storage directly from components but rather have updateItem('key',item). I think you get my point.

Read about repository pattern, it could be applied on any db structure, including local storage.
IndexDB may be the better solution here, but changing the stack due to bad implemention does no seem reasonable to me.",Javascript
"IndexedDB is probably what you want, but it can be a bit of a pain to get set up with.

localForage ([https://localforage.github.io/localForage/](https://localforage.github.io/localForage/)) mirrors localStorage syntax, but uses IndexedDB in the background.  
If that's not supported, it uses WebSQL and then LocalStorage",Javascript
"I literally just merged my PR with CSS-in-JS replacement with CSS Modules. I was fixated on using it just because everybody else was doing it I kinda los the sight of the purpose here.   
CSS Variables and SASS really do their jobs good enough to ditch any CSS-in-JS I'd need.",Javascript
"
It’ll depend completely on the specifications for the output and how easy it is to optimise for it. Some languages lend themselves to be easier for it but it’s far far FARRRR away from gaining mass adoption",Javascript
"WASM makes sense as a target for plugins but not as a replacement for frontend frameworks. You can't access the DOM from WASM so there would be overhead for any solution. Besides, the point of a frontend framework is to provide practical conventions to build off of, improve developer productivity. WASM-based framework bindings  would need to be very abstract in order to support the variety of language implementations, and each implementation would introduce different behavior, so the benefits really fall away.",Javascript
